{
  "debug": true,
  "server": {
    "url": "http://localhost:1810",
    "token": "fixture-token-0001",
    "tls_verify": false,
    "python_bin": "/opt/miloco/.venv/bin/python"
  },
  "agent": {
    "webhook_url": "http://127.0.0.1:18789/miloco/webhook",
    "auth_bearer": "fixture-gateway-token"
  },
  "model": {
    "omni": {
      "model": "mimo-v2.6-flash",
      "base_url": "https://api.xiaomimimo.com/v1",
      "api_key": "sk-fixture-xxxx"
    }
  },
  "scheduler": {
    "enabled": false
  },
  "notify": {
    "dedup_window_sec": 120
  }
}
